{
  "schemaVersion": "1.0",
  "examId": "mgdp-2",
  "visibility": "private",
  "gradingMode": "criteria-keyword-assisted",
  "rubrics": [
    {
      "subtaskId": "PB4-W1-a",
      "maxPoints": 2.6666666666666665,
      "modelAnswer": "Option a ist fachlich passend.",
      "gradingNotes": "Uebungsrubric, keine offizielle IHK-Loesung.",
      "criteria": [
        {
          "id": "c1",
          "points": 2.6666666666666665,
          "description": "Die fachlich passende Option wurde gewaehlt.",
          "keywords": [
            "a"
          ]
        }
      ]
    },
    {
      "subtaskId": "PB4-W2-a",
      "maxPoints": 2.6666666666666665,
      "modelAnswer": "Option a ist fachlich passend.",
      "gradingNotes": "Uebungsrubric, keine offizielle IHK-Loesung.",
      "criteria": [
        {
          "id": "c1",
          "points": 2.6666666666666665,
          "description": "Die fachlich passende Option wurde gewaehlt.",
          "keywords": [
            "a"
          ]
        }
      ]
    },
    {
      "subtaskId": "PB4-W3-a",
      "maxPoints": 2.6666666666666665,
      "modelAnswer": "Option a ist fachlich passend.",
      "gradingNotes": "Uebungsrubric, keine offizielle IHK-Loesung.",
      "criteria": [
        {
          "id": "c1",
          "points": 2.6666666666666665,
          "description": "Die fachlich passende Option wurde gewaehlt.",
          "keywords": [
            "a"
          ]
        }
      ]
    },
    {
      "subtaskId": "PB4-W4-a",
      "maxPoints": 2.6666666666666665,
      "modelAnswer": "Option a ist fachlich passend.",
      "gradingNotes": "Uebungsrubric, keine offizielle IHK-Loesung.",
      "criteria": [
        {
          "id": "c1",
          "points": 2.6666666666666665,
          "description": "Die fachlich passende Option wurde gewaehlt.",
          "keywords": [
            "a"
          ]
        }
      ]
    },
    {
      "subtaskId": "PB4-W5-a",
      "maxPoints": 2.6666666666666665,
      "modelAnswer": "Option a ist fachlich passend.",
      "gradingNotes": "Uebungsrubric, keine offizielle IHK-Loesung.",
      "criteria": [
        {
          "id": "c1",
          "points": 2.6666666666666665,
          "description": "Die fachlich passende Option wurde gewaehlt.",
          "keywords": [
            "a"
          ]
        }
      ]
    },
    {
      "subtaskId": "PB4-W6-a",
      "maxPoints": 2.6666666666666665,
      "modelAnswer": "Option a ist fachlich passend.",
      "gradingNotes": "Uebungsrubric, keine offizielle IHK-Loesung.",
      "criteria": [
        {
          "id": "c1",
          "points": 2.6666666666666665,
          "description": "Die fachlich passende Option wurde gewaehlt.",
          "keywords": [
            "a"
          ]
        }
      ]
    },
    {
      "subtaskId": "PB4-W7-a",
      "maxPoints": 2.6666666666666665,
      "modelAnswer": "Option a ist fachlich passend.",
      "gradingNotes": "Uebungsrubric, keine offizielle IHK-Loesung.",
      "criteria": [
        {
          "id": "c1",
          "points": 2.6666666666666665,
          "description": "Die fachlich passende Option wurde gewaehlt.",
          "keywords": [
            "a"
          ]
        }
      ]
    },
    {
      "subtaskId": "PB4-W8-a",
      "maxPoints": 2.6666666666666665,
      "modelAnswer": "Option a ist fachlich passend.",
      "gradingNotes": "Uebungsrubric, keine offizielle IHK-Loesung.",
      "criteria": [
        {
          "id": "c1",
          "points": 2.6666666666666665,
          "description": "Die fachlich passende Option wurde gewaehlt.",
          "keywords": [
            "a"
          ]
        }
      ]
    },
    {
      "subtaskId": "PB4-W9-a",
      "maxPoints": 2.6666666666666665,
      "modelAnswer": "Option a ist fachlich passend.",
      "gradingNotes": "Uebungsrubric, keine offizielle IHK-Loesung.",
      "criteria": [
        {
          "id": "c1",
          "points": 2.6666666666666665,
          "description": "Die fachlich passende Option wurde gewaehlt.",
          "keywords": [
            "a"
          ]
        }
      ]
    },
    {
      "subtaskId": "PB4-W10-a",
      "maxPoints": 2.6666666666666665,
      "modelAnswer": "Option a ist fachlich passend.",
      "gradingNotes": "Uebungsrubric, keine offizielle IHK-Loesung.",
      "criteria": [
        {
          "id": "c1",
          "points": 2.6666666666666665,
          "description": "Die fachlich passende Option wurde gewaehlt.",
          "keywords": [
            "a"
          ]
        }
      ]
    },
    {
      "subtaskId": "PB4-W11-a",
      "maxPoints": 2.6666666666666665,
      "modelAnswer": "Option a ist fachlich passend.",
      "gradingNotes": "Uebungsrubric, keine offizielle IHK-Loesung.",
      "criteria": [
        {
          "id": "c1",
          "points": 2.6666666666666665,
          "description": "Die fachlich passende Option wurde gewaehlt.",
          "keywords": [
            "a"
          ]
        }
      ]
    },
    {
      "subtaskId": "PB4-W12-a",
      "maxPoints": 2.6666666666666665,
      "modelAnswer": "Option a ist fachlich passend.",
      "gradingNotes": "Uebungsrubric, keine offizielle IHK-Loesung.",
      "criteria": [
        {
          "id": "c1",
          "points": 2.6666666666666665,
          "description": "Die fachlich passende Option wurde gewaehlt.",
          "keywords": [
            "a"
          ]
        }
      ]
    },
    {
      "subtaskId": "PB4-W13-a",
      "maxPoints": 2.6666666666666665,
      "modelAnswer": "Option a ist fachlich passend.",
      "gradingNotes": "Uebungsrubric, keine offizielle IHK-Loesung.",
      "criteria": [
        {
          "id": "c1",
          "points": 2.6666666666666665,
          "description": "Die fachlich passende Option wurde gewaehlt.",
          "keywords": [
            "a"
          ]
        }
      ]
    },
    {
      "subtaskId": "PB4-W14-a",
      "maxPoints": 2.6666666666666665,
      "modelAnswer": "Option a ist fachlich passend.",
      "gradingNotes": "Uebungsrubric, keine offizielle IHK-Loesung.",
      "criteria": [
        {
          "id": "c1",
          "points": 2.6666666666666665,
          "description": "Die fachlich passende Option wurde gewaehlt.",
          "keywords": [
            "a"
          ]
        }
      ]
    },
    {
      "subtaskId": "PB4-W15-a",
      "maxPoints": 2.6666666666666665,
      "modelAnswer": "Option a ist fachlich passend.",
      "gradingNotes": "Uebungsrubric, keine offizielle IHK-Loesung.",
      "criteria": [
        {
          "id": "c1",
          "points": 2.6666666666666665,
          "description": "Die fachlich passende Option wurde gewaehlt.",
          "keywords": [
            "a"
          ]
        }
      ]
    },
    {
      "subtaskId": "PB4-W16-a",
      "maxPoints": 2.6666666666666665,
      "modelAnswer": "Option a ist fachlich passend.",
      "gradingNotes": "Uebungsrubric, keine offizielle IHK-Loesung.",
      "criteria": [
        {
          "id": "c1",
          "points": 2.6666666666666665,
          "description": "Die fachlich passende Option wurde gewaehlt.",
          "keywords": [
            "a"
          ]
        }
      ]
    },
    {
      "subtaskId": "PB4-W17-a",
      "maxPoints": 2.6666666666666665,
      "modelAnswer": "Option a ist fachlich passend.",
      "gradingNotes": "Uebungsrubric, keine offizielle IHK-Loesung.",
      "criteria": [
        {
          "id": "c1",
          "points": 2.6666666666666665,
          "description": "Die fachlich passende Option wurde gewaehlt.",
          "keywords": [
            "a"
          ]
        }
      ]
    },
    {
      "subtaskId": "PB4-W18-a",
      "maxPoints": 2.6666666666666665,
      "modelAnswer": "Option a ist fachlich passend.",
      "gradingNotes": "Uebungsrubric, keine offizielle IHK-Loesung.",
      "criteria": [
        {
          "id": "c1",
          "points": 2.6666666666666665,
          "description": "Die fachlich passende Option wurde gewaehlt.",
          "keywords": [
            "a"
          ]
        }
      ]
    },
    {
      "subtaskId": "PB4-W19-a",
      "maxPoints": 12,
      "modelAnswer": "Bewertungshorizont zu Rechte und Pflichten in der Ausbildung: fachlich richtige, situationsbezogene Antwort mit nachvollziehbarer Begruendung.",
      "alternativeCorrectAnswers": [
        "sinngemaesse fachlich korrekte Loesung",
        "abweichende, aber fachlich begruendete Entscheidung"
      ],
      "gradingNotes": "Nicht als 1:1-Musterloesungsvergleich verwenden; Kriterien, Fachsinn und Situationsbezug bewerten.",
      "criteria": [
        {
          "id": "c1",
          "points": 4.8,
          "description": "Fachbegriffe, Kriterien oder Rechenschritte sind korrekt genannt.",
          "keywords": [
            "rechte und pflichten in der ausbildung",
            "wiso",
            "zielgruppe",
            "kunde",
            "betrieb",
            "produkt",
            "produktion",
            "workflow",
            "layout",
            "farbe",
            "typografie",
            "daten",
            "qualitaet",
            "druck",
            "recht",
            "beschnitt",
            "profil",
            "preflight",
            "begruen",
            "weil",
            "dadurch"
          ]
        },
        {
          "id": "c2",
          "points": 4.2,
          "description": "Die Antwort bezieht sich auf Auftrag, Kunde, Zielgruppe, Daten oder Produktion.",
          "keywords": [
            "kunde",
            "auftrag",
            "zielgruppe",
            "produkt",
            "situation",
            "daten",
            "produktion",
            "workflow",
            "betrieb"
          ]
        },
        {
          "id": "c3",
          "points": 3,
          "description": "Die Entscheidung oder Massnahme wird nachvollziehbar begruendet.",
          "keywords": [
            "weil",
            "dadurch",